{
  "name": "mobile-booking",
  "target": "mobile",
  "archetype": "booking",
  "stack": {
    "framework": "Expo",
    "language": "TypeScript",
    "styling": "NativeWind",
    "navigation": "Expo Router",
    "data": "local-state"
  },
  "status": "planned",
  "references": [
    "knowledge/archetypes/booking.md",
    "knowledge/data-models/booking.md",
    "knowledge/screen-graphs/booking.md",
    "knowledge/ui-patterns/forms.md",
    "knowledge/ui-patterns/navigation.md",
    "knowledge/design-playbooks/mobile-utility.md",
    "knowledge/design-playbooks/ui-quality.md",
    "knowledge/quality-rubrics/mobile-app.md",
    "templates/mobile/booking/TEMPLATE_PLAN.md"
  ]
}
